[
  {
    "id": "back_squat",
    "name": "Back Squat",
    "category": "barbell",
    "modality": ["max_strength", "relative_strength"],
    "equipment": ["barbell", "rack", "plates"],
    "effort": "high",
    "bilateral": true,
    "movement_patterns": ["squat"],
    "requires": ["hip_hinge", "bracing_mechanics"],
    "unlocks": ["front_squat", "overhead_squat"],
    "contraindicated_with": ["knee_meniscus_post_op", "hip_flexor_strain"],
    "progressions": { "load": "add 2.5–5kg/session (novice)", "volume": "3×5 → 5×5", "complexity": "front_squat" },
    "scaling_down": ["box_squat", "goblet_squat"],
    "typical_volume": { "sets": 3, "reps": 5 },
    "sources": ["Starting Strength", "Horsemen", "Gym Jones"],
    "notes": "Master the hip hinge and bracing before loading."
  },
  {
    "id": "deadlift",
    "name": "Deadlift",
    "category": "barbell",
    "modality": ["max_strength", "durability"],
    "equipment": ["barbell", "plates"],
    "effort": "max",
    "bilateral": true,
    "movement_patterns": ["hip_hinge", "pull"],
    "requires": ["bracing_mechanics"],
    "unlocks": ["trap_bar_deadlift", "sumo_deadlift", "romanian_deadlift"],
    "contraindicated_with": ["lumbar_disc"],
    "progressions": { "load": "add 5kg/session (novice)", "volume": "1×5 → 3×5" },
    "scaling_down": ["trap_bar_deadlift", "romanian_deadlift"],
    "typical_volume": { "sets": 1, "reps": 5 },
    "sources": ["Starting Strength", "Horsemen"],
    "notes": "Always pulls 1×5 in novice linear progression."
  },
  {
    "id": "overhead_press",
    "name": "Overhead Press",
    "category": "barbell",
    "modality": ["max_strength", "relative_strength"],
    "equipment": ["barbell", "rack", "plates"],
    "effort": "high",
    "bilateral": true,
    "movement_patterns": ["press"],
    "requires": ["bracing_mechanics"],
    "unlocks": ["push_press", "split_jerk"],
    "contraindicated_with": ["shoulder_impingement", "shoulder_instability"],
    "progressions": { "load": "add 2.5kg/session (novice)", "volume": "3×5 → 5×5" },
    "scaling_down": ["landmine_press", "db_shoulder_press"],
    "typical_volume": { "sets": 3, "reps": 5 },
    "sources": ["Starting Strength", "Horsemen"],
    "notes": "Grip just outside shoulder width."
  },
  {
    "id": "bench_press",
    "name": "Bench Press",
    "category": "barbell",
    "modality": ["max_strength", "relative_strength"],
    "equipment": ["barbell", "rack", "plates"],
    "effort": "high",
    "bilateral": true,
    "movement_patterns": ["press"],
    "requires": ["bracing_mechanics"],
    "unlocks": ["close_grip_bench", "incline_bench"],
    "contraindicated_with": ["shoulder_impingement", "shoulder_instability", "wrist_injury"],
    "progressions": { "load": "add 2.5kg/session (novice)", "volume": "3×5 → 5×5" },
    "scaling_down": ["db_bench_press", "push_up"],
    "typical_volume": { "sets": 3, "reps": 5 },
    "sources": ["Starting Strength"],
    "notes": "Alternates with press in SS LP."
  },
  {
    "id": "power_clean",
    "name": "Power Clean",
    "category": "barbell",
    "modality": ["power", "max_strength"],
    "equipment": ["barbell", "plates"],
    "effort": "max",
    "bilateral": true,
    "movement_patterns": ["hip_hinge", "pull", "ballistic"],
    "requires": ["deadlift", "front_rack_position"],
    "unlocks": ["squat_clean", "clean_and_jerk"],
    "contraindicated_with": ["lumbar_disc", "wrist_injury", "shoulder_instability"],
    "progressions": { "load": "add 2.5kg/session", "complexity": "squat_clean" },
    "scaling_down": ["hang_power_clean", "dumbbell_clean"],
    "typical_volume": { "sets": 5, "reps": 3 },
    "sources": ["Starting Strength"],
    "notes": "Catch above parallel in power position."
  },
  {
    "id": "kb_swing",
    "name": "Kettlebell Swing",
    "category": "kettlebell",
    "modality": ["power", "strength_endurance", "aerobic_base"],
    "equipment": ["kettlebell"],
    "effort": "high",
    "bilateral": true,
    "movement_patterns": ["hip_hinge", "ballistic"],
    "requires": ["hip_hinge"],
    "unlocks": ["kb_single_arm_swing", "kb_clean", "kb_snatch"],
    "contraindicated_with": ["lumbar_disc", "hip_flexor_strain"],
    "progressions": { "load": "progress bell weight", "volume": "increase reps/sets", "complexity": "kb_single_arm_swing" },
    "scaling_down": ["hip_hinge_drill", "deadlift_practice"],
    "typical_volume": { "sets": 5, "reps": 20 },
    "sources": ["Wildman Kettlebell", "Horsemen"],
    "notes": "The swing is the foundation of all KB ballistics."
  },
  {
    "id": "kb_turkish_getup",
    "name": "Turkish Get-Up",
    "category": "kettlebell",
    "modality": ["mobility", "relative_strength", "movement_skill"],
    "equipment": ["kettlebell"],
    "effort": "medium",
    "bilateral": false,
    "movement_patterns": ["carry", "press"],
    "requires": ["shoulder_stability"],
    "unlocks": ["kb_windmill", "kb_flow"],
    "contraindicated_with": ["shoulder_impingement", "wrist_injury"],
    "progressions": { "load": "progress bell weight", "volume": "5 per side → 10 per side" },
    "scaling_down": ["bodyweight_getup", "half_getup"],
    "typical_volume": { "sets": 1, "reps": 5 },
    "sources": ["Wildman Kettlebell", "Ido Portal"],
    "notes": "Never rush the TGU. Every position is a pause."
  },
  {
    "id": "kb_clean",
    "name": "Kettlebell Clean",
    "category": "kettlebell",
    "modality": ["power", "strength_endurance"],
    "equipment": ["kettlebell"],
    "effort": "high",
    "bilateral": false,
    "movement_patterns": ["hip_hinge", "ballistic", "pull"],
    "requires": ["kb_swing"],
    "unlocks": ["kb_press", "kb_jerk", "kb_snatch"],
    "contraindicated_with": ["shoulder_instability", "wrist_injury"],
    "progressions": { "load": "progress bell weight", "complexity": "kb_snatch" },
    "scaling_down": ["kb_swing"],
    "typical_volume": { "sets": 5, "reps": 5 },
    "sources": ["Wildman Kettlebell"],
    "notes": "Keep the bell close; elbow leads the catch."
  },
  {
    "id": "kb_snatch",
    "name": "Kettlebell Snatch",
    "category": "kettlebell",
    "modality": ["power", "strength_endurance"],
    "equipment": ["kettlebell"],
    "effort": "max",
    "bilateral": false,
    "movement_patterns": ["hip_hinge", "ballistic", "pull"],
    "requires": ["kb_clean", "kb_single_arm_swing"],
    "unlocks": ["kb_pentathlon"],
    "contraindicated_with": ["shoulder_instability", "wrist_injury"],
    "progressions": { "load": "progress bell weight", "volume": "RPM targets" },
    "scaling_down": ["kb_clean", "kb_single_arm_swing"],
    "typical_volume": { "sets": 5, "reps": 5 },
    "sources": ["Wildman Kettlebell"],
    "notes": "The apex of the KB ballistic progression."
  },
  {
    "id": "pull_up",
    "name": "Pull-Up",
    "category": "bodyweight",
    "modality": ["relative_strength", "max_strength"],
    "equipment": ["pull_up_bar"],
    "effort": "high",
    "bilateral": true,
    "movement_patterns": ["pull"],
    "requires": [],
    "unlocks": ["weighted_pull_up", "muscle_up"],
    "contraindicated_with": ["shoulder_impingement", "golfers_elbow"],
    "progressions": { "load": "add weight via belt", "volume": "increase reps", "complexity": "muscle_up" },
    "scaling_down": ["ring_row", "lat_pulldown", "band_assisted_pull_up"],
    "typical_volume": { "sets": 3, "reps": 8 },
    "sources": ["Horsemen", "Gym Jones"],
    "notes": "Dead hang start, chin over bar. Full ROM always."
  },
  {
    "id": "run",
    "name": "Run (Zone 2)",
    "category": "aerobic",
    "modality": ["aerobic_base"],
    "equipment": ["open_space"],
    "effort": "low",
    "bilateral": true,
    "movement_patterns": ["locomotion"],
    "requires": [],
    "unlocks": ["threshold_run", "tempo_run"],
    "contraindicated_with": ["knee_meniscus_post_op", "ankle_sprain", "achilles_tendinopathy"],
    "progressions": { "volume": "add 10% weekly" },
    "scaling_down": ["bike", "row", "elliptical"],
    "typical_volume": { "sets": 1, "reps": 1 },
    "sources": ["Uphill Athlete", "CrossFit Endurance"],
    "notes": "Conversational pace; nasal breathing test."
  },
  {
    "id": "ruck",
    "name": "Ruck (Loaded)",
    "category": "aerobic",
    "modality": ["durability", "aerobic_base"],
    "equipment": ["ruck_pack"],
    "effort": "medium",
    "bilateral": true,
    "movement_patterns": ["carry", "locomotion"],
    "requires": [],
    "unlocks": [],
    "contraindicated_with": ["knee_meniscus_post_op", "lumbar_disc"],
    "progressions": { "load": "add 2kg/2 weeks", "volume": "extend distance" },
    "scaling_down": ["walk"],
    "typical_volume": { "sets": 1, "reps": 1 },
    "sources": ["Horsemen", "Uphill Athlete"],
    "notes": "Start 20% BW. Work to 30-35% for selection prep."
  },
  {
    "id": "farmer_carry",
    "name": "Farmer Carry",
    "category": "carries",
    "modality": ["durability", "strength_endurance"],
    "equipment": ["kettlebell"],
    "effort": "high",
    "bilateral": true,
    "movement_patterns": ["carry"],
    "requires": [],
    "unlocks": ["suitcase_carry", "overhead_carry"],
    "contraindicated_with": ["tennis_elbow", "golfers_elbow"],
    "progressions": { "load": "progress weight", "volume": "increase distance" },
    "scaling_down": [],
    "typical_volume": { "sets": 3, "reps": 1 },
    "sources": ["Horsemen", "Gym Jones"],
    "notes": "Chest up, shoulders packed. No torso lean."
  },
  {
    "id": "sandbag_clean_press",
    "name": "Sandbag Clean & Press",
    "category": "sandbag",
    "modality": ["strength_endurance", "durability", "power"],
    "equipment": ["sandbag"],
    "effort": "high",
    "bilateral": true,
    "movement_patterns": ["hip_hinge", "press", "ballistic"],
    "requires": ["hip_hinge"],
    "unlocks": ["sandbag_complex"],
    "contraindicated_with": ["lumbar_disc", "shoulder_impingement"],
    "progressions": { "load": "heavier bag", "volume": "more rounds" },
    "scaling_down": ["kb_clean_press"],
    "typical_volume": { "sets": 5, "reps": 5 },